{
  "word": "apple",
  "results": [
    {
      "definition": {},
      "partOfSpeech": {},
      "synonyms": {},
      "antonyms": {},
      "examples": {},
      "typeOf": {},
      "hasTypes": {},
      "partOf": {},
      "hasParts": {},
      "instanceOf": {},
      "hasInstances": {},
      "similarTo": {},
      "also": {},
      "entails": {},
      "memberOf": {},
      "hasMembers": {},
      "substanceOf": {},
      "hasSubstances": {},
      "inCategory": {},
      "hasCategories": {},
      "usageOf": {},
      "hasUsages": {},
      "inRegion": {},
      "regionOf": {},
      "pertainsTo": {}
    },
    {
      "definition": {},
      "partOfSpeech": {},
      "synonyms": {},
      "antonyms": {},
      "examples": {},
      "typeOf": {},
      "hasTypes": {},
      "partOf": {},
      "hasParts": {},
      "instanceOf": {},
      "hasInstances": {},
      "similarTo": {},
      "also": {},
      "entails": {},
      "memberOf": {},
      "hasMembers": {},
      "substanceOf": {},
      "hasSubstances": {},
      "inCategory": {},
      "hasCategories": {},
      "usageOf": {},
      "hasUsages": {},
      "inRegion": {},
      "regionOf": {},
      "pertainsTo": {}
    },
    {
      "definition": {},
      "partOfSpeech": {},
      "synonyms": {},
      "antonyms": {},
      "examples": {},
      "typeOf": {},
      "hasTypes": {},
      "partOf": {},
      "hasParts": {},
      "instanceOf": {},
      "hasInstances": {},
      "similarTo": {},
      "also": {},
      "entails": {},
      "memberOf": {},
      "hasMembers": {},
      "substanceOf": {},
      "hasSubstances": {},
      "inCategory": {},
      "hasCategories": {},
      "usageOf": {},
      "hasUsages": {},
      "inRegion": {},
      "regionOf": {},
      "pertainsTo": {}
    }
  ],
  "syllables": {
    "count": 2,
    "list": [
      "ap",
      "ple"
    ]
  },
  "pronunciation": {
    "all": "\u02c8\u00e6p.\u0259l",
    "noun": "apple",
    "verb": "walk",
    "adjective": "happy",
    "adverb": "apple"
  },
  "frequency": 4.83
}